lemma	pos	date	grouping	identifier	description	context	indexes_target_token	indexes_target_sentence
бог	NN	example	22	22_бог_23863		Так было с церковью, первоначально основанной на стремлении к Богу и заканчивающейся сейчас спором конфессий: чей Бог лучше?	62:65	0:124
бог	NN	example	22	22_бог_23308		Боже, откуда моя банка!	0:4	0:23
бог	NN	example	22	22_бог_30933		-- Они и бога подменили нам, они все, что у них в руках, против нас направляют!	9:13	0:79
бог	NN	example	22	22_бог_3569		Сохрани бог...	8:11	0:14
бог	NN	example	22	22_бог_20053		Бог среди Своих творений произвел рай; Царство Божие, как говорит Тейяр де Шарден, уже присутствует в этом мире.	0:3	0:112
бог	NN	example	22	22_бог_22519		Мы не говорим, конечно,«умри» Богу-- но Господь на Кресте умер нашим грехом...	30:34	0:78
бог	NN	example	22	22_бог_9764		Бралась медная или стальная трубка, бог знает как и зачем попавшая в Олепино и найденная где-нибудь в мусоре.	36:39	0:109
бог	NN	example	22	22_бог_31583		Все люди, когда удят, не кричат, не разговаривают, чтобы не пугать,-- Ларион поёт неумолчно, а то рассказывает мне жития разные или о боге говорит, и всегда к нему рыба шла.	134:138	0:173
бог	NN	example	22	22_бог_35685		В бреду он говорил, что господь бог во всем великолепии снизошел на землю и на ней водворилось царствие божье, возмутительно, бесчеловечно удерживать его здесь, в юдоли слез, стенаний и вечных мук, когда он может воссоединиться с отцом и дорогими родными и пребывать в вечном блаженстве и чистейшей радости.	32:35	0:307
бог	NN	example	22	22_бог_39204		Лучшее от стад наших богу Килору.	21:25	0:33
бог	NN	example	22	22_бог_44246		И поспешил Пипо Розетти к выходу поглядеть, кого это господь бог, не забывающий своего Пипо, подкинул«Конкордии».	61:64	0:113
бог	NN	example	22	22_бог_67206		Вот, батюшка Петр Авдеевич, дождемся снежку да доживем, бог даст, до святок; на евтих-то местах зверья бывает такое множество, что отбоя нет суседним деревням; коли милости вашей да захочется поохотиться, уж я вам доложу, барин, охота будет отменная.	56:59	0:250
бог	NN	example	22	22_бог_62470		Былъ я въ Москвѣ и думалъ: авось, богъ милостивъ, увижу гдѣ нибудь чинно сидящаго моего черного друга, или въ креслахъ театральныхъ или въ рестораціи за бутылкой.	34:38	0:162
бог	NN	example	22	22_бог_44087		Вот он, бог-то, страдать заставляющий.	8:11	0:38
бог	NN	example	22	22_бог_62211		Это какая-то смесь, букет какой-то, составленный из запаха капусты, кислых полушубков и дегтярных сапог, смешанный с запахом живого человеческого тела, и притом такого тела, которое бог знает с которых пор не было в бане и страдает изнурительной испариной; только испарина эта уж остыла и прокисла.	182:185	0:298
бог	NN	example	22	22_бог_27324		-- Не боги горшки обжигают, милый Егор Иванович.	6:10	0:48
бог	NN	example	22	22_бог_58586		Счастлив твой бог, что я сама тут виновата, позволила Фетинье ходить одной, а то досталось бы тебе на орехи!	14:17	0:108
бог	NN	example	22	22_бог_35855		Джованни наблюдал за выражением человеческой слабости в лице учителя и, вспоминая слова одного из поклонников Леонардо:«новый бог Гермес Трисмегист соединился в нем с новым титаном Прометеем»,-- думал с улыбкою:	126:129	0:211
бог	NN	example	22	22_бог_56679		Плетни устроены из кустов кактуса и алоэ: не дай бог схватиться за куст-- что наша крапива!	49:52	0:91
бог	NN	example	22	22_бог_60297		Всегда с самых древних времен, люди чувствовали бедственность, непрочность и бессмысленность своего существования и искали спасения от этой бедственности, непрочности и бессмысленности в вере в бога или богов, которые могли бы избавлять их от различных бед этой жизни и в будущей жизни давали бы им то благо, которого они желали и не могли получить в этой жизни.	194:198	0:362
бог	NN	example	22	22_бог_52587		Бог, создавая женщину, чтоб быть дочерью и сестрою, велел ей также быть супругою и матерью, и эти две цели-- едва ли не главные, ей предназначенные...	0:3	0:150
бог	NN	example	22	22_бог_73359		-- Вы здесь две службы сослужите: одну службу богу, а другую-- мне.	46:50	0:67
бог	NN	example	22	22_бог_52113		Не имея ни отца, ни матери, забытая родными, покинутая всеми людьми, устремилась я к богу, посвятила себя на служение ему, нашла в нем отраду, счастие.	85:89	0:151
бог	NN	example	22	22_бог_7966		Ну ты сам знаешь, в раздетом виде я смотрюсь как бог со своей грудной клеткой и бицепсами.	49:52	0:90
бог	NN	example	22	22_бог_16562		Сейчас я связной с богами, и никого не удивляет, почему Маша уходит именно со мной.	19:25	0:83
бог	NN	example	22	22_бог_72758		-- Боже, как вы в самом деле откровенны!	3:7	0:40
бог	NN	example	22	22_бог_24471		-- Слава богу, слава богу,-- представив, я содрогнулась: если бы не смех, если бы повернула ключ...	9:13	0:99
бог	NN	example	22	22_бог_45693		-- А только,-- закончил Ощера,-- Бога ради торопись из Москвы!	33:37	0:62
бог	NN	example	22	22_бог_27684		У человека в глубине души сохранилась, даже, и после смерти богов, неистребимая любовь к сотворенному ими-- мудрость собирает все свои силы и ополчается против ηδονη и κατα πάθος: так окрестила она любовь человека к божьему миру.	60:65	0:229
бог	NN	example	22	22_бог_24460		Я же был в Греции, она тоже страна христианская, но все магазины сувениров заставлены статуэтками олимпийских богов.	5:8	0:116
бог	NN	example	22	22_бог_37574		Невольно родилась мысль: если ты, бог, всемогущ, так что же ты смотришь?	34:37	0:72
бог	NN	example	22	22_бог_32952		Видно, и впрямь говорил поп Федот под весёлую руку, что мир заделывал бог, хорошо не подумав, и многое сотворил впопыхах, почему и пришлось потом уж на свободе доделывать чёрту!	70:73	0:177
бог	NN	example	22	22_бог_66300		Никогда, ни в чьем лице я не видал подобных перемен, и со всем тем, бог знает отчего, а я догадывался, что перемена эта признак близкой смерти.	68:71	0:143
бог	NN	example	22	22_бог_17547		В VII веке до нашей эры древние греки поставили здесь храм богини Геры, а спустя два века возвели грандиозный храм Зевса с величественной статуей бога.	146:150	0:151
бог	NN	example	22	22_бог_66144		В трагедиях участвуют боги, цари и герои, а вы-- чиновник и чиновница; потому и роман ваш будет мирный, без классических принадлежностей, без яду, бешеной борьбы, проклятий и дуэлей...	22:26	0:184
