lemma	pos	date	grouping	identifier	description	context	indexes_target_token	indexes_target_sentence
раз	NN	example	22	22_раз_64728		-- Написаны чернилами,-- еще раз подтвердил Трубка.	29:32	0:51
раз	NN	example	22	22_раз_114802		Во Франции в августе 1949 года цены на продукты питания были в 20,2 раза выше по сравнению с 1937 годом.	68:72	0:104
раз	NN	example	22	22_раз_59449		Коломнин как раз пилсоколо	13:16	0:26
раз	NN	example	22	22_раз_224342		Не сразу отказавшись от Хлоповой, Михаил Федорович женился только на 29 году своей жизни(случай крайне редкий, потому что браки тогда обыкновенно совершались рано) на Марии Владимировне Долгоруковой, скоро умершей, а затем, во второй раз, на Евдокии Лукьяновне Стрешневой.	4:7	0:272
раз	NN	example	22	22_раз_76835		Когда я тебя кусал последний раз, а, Самарцев?	29:32	0:46
раз	NN	example	22	22_раз_270537		Несколько парламентов, созванных один за другим, отменили, во-первых, 6 статей, изданных Генрихом; потом были разрешены брак для духовенства, причастие под двумя видами, чтение всеми Священного писания на родном языке; издано было собрание проповедей, составленных Кранмером, которые каждый священник в Англии должен был, по крайней мере, 4 раза в год читать своим прихожанам, если не мог сам составлять проповедей в этом духе; составлен катехизис по образцу Лютерова.	341:345	0:468
раз	NN	example	22	22_раз_205162		Что же касается сослуживцев, то это были люди серьезные и шутили только раз в году-первого апреля.	72:75	0:98
раз	NN	example	22	22_раз_50997		Когда на всех других фронтах уже затихало, самые последние и жестокие весенние бои вели в Крыму как раз обе эти армии-- и та, из которой полковник, и та, из которой Велихов,-- и, если обойти госпиталь, наверное, каждый третий долечивающий раны офицер сейчас оттуда, из Крыма.	100:103	0:275
раз	NN	example	22	22_раз_111491		Этого-то как раз мои критики не поняли или скорее всего не хотели понимать.	13:16	0:75
раз	NN	example	22	22_раз_73952		Тула решила закрыть проблему раз и навсегда и все-таки убить неудобного парня, который поначалу вел себя, как крутой, а потом отчего-то расхотел быть как все.	29:32	0:158
раз	NN	example	22	22_раз_197586		Турецкий корабль, защищенный броней и неуязвимый для пушек«Константина», обладал в несколько раз более мощной и дальнобойной артиллерией.	93:96	0:137
раз	NN	example	22	22_раз_238856		Он, подобно отцу, раз взявшись за что-либо, предавался весь работе, однако всё же для него больного, усталого-- эта работа не была каким-то отдохновением.	18:21	0:154
раз	NN	example	22	22_раз_63073		И каждый раз так, заново радуя, завораживая: вот он!	9:12	0:52
раз	NN	example	22	22_раз_325324		Так говорила нянюшка, а хлебнув одну ложку, столь приятной показалась ей похлебка, что она и в другой раз прихлебнула, потом и в третий.	102:105	0:136
раз	NN	example	22	22_раз_209846		В прошлом году, например, ряд театров периферии, гастролировавших в Москве и Ленинграде-- Саратовский, Харьковский театр драмы, Свердловский,-- всячески эксплоатировали«Анну Каренину», ставя спектакль по 10-- 15 раз, а такие пьесы, как«Человек с ружьем»,«Мера за меру»,«Беспокойная старость»,-- по 3-- 4 раза.	212:215	0:309
раз	NN	example	22	22_раз_125266		Сколько раз мне хотелось подняться!	8:11	0:35
раз	NN	example	22	22_раз_22533		Оглянулся, и как раз в этот момент, прячась за спинами прохожих, косорылый сделал рукой неприметный жест, обращенный куда-то в сторону.	17:20	0:135
раз	NN	example	22	22_раз_95058		Но как раз здесь и есть большая проблема.	7:10	0:41
раз	NN	example	22	22_раз_213605		Иногда Рейтер уныло делает попытку сообщить фамилии главных деятелей этих кабинетов-- и всякий раз почему-то кажется, что фамилии им перевраны: так нам трудно привыкнуть к мысли, что премьерами, президентами, министрами могут быть люди, решительно никому на свете неизвестные.	95:98	0:276
раз	NN	example	22	22_раз_32008		Есть службы, которые привозят продукты, раз в неделю приходит уборщица.	40:43	0:71
раз	NN	example	22	22_раз_169613		А если инвестировать предполагается в десять--двадцать раз больше?	55:58	0:66
раз	NN	example	22	22_раз_128589		У перепончатокрылых их как раз 4-- вот и начало превращения мухи в осу.	27:30	0:71
раз	NN	example	22	22_раз_314246		И сколько раз подобные открытия давали вдруг совершенно неожиданно объяснения явлениям, казавшимся случайными, и соединяли эти казавшиеся случайными явления в последовательную и логически развивающуюся цель.	10:13	0:207
раз	NN	example	22	22_раз_67971		Он лежал, прижимаясь щекой к траве, и глядел на мертвяка, а тот стоял, шатаясь, медленно распахиваясь, как чемодан, по всей длине оранжевого туловища, а потом оступился и рухнул навзничь, заливая все вокруг густой белой жидкостью, дернулся несколько раз и замер.	250:253	0:262
раз	NN	example	22	22_раз_166649		Почти всегда однажды виденное кажется более красивым, чем то, что видишь в первый раз.	82:85	0:86
раз	NN	example	22	22_раз_10258		Долг гражданина, как я его понимаю в этом(впрочем, и в других случаях), находится как раз на границе с уголовной ответственностью.	86:89	0:130
раз	NN	example	22	22_раз_284620		Жить надо, прежде всякого рассуждения мы жили и живем: каждые сутки спим, несколько раз едим, движемся, мыслим.	84:87	0:111
раз	NN	example	22	22_раз_263458		Затем еще раз-- это было как-то под вечер-- на юге вечер наступает рано, едва ли не часов с семи,-- возвращаясь с отдаленной загородной прогулки, я по дороге присел отдохнуть на одну из лавочек под липами, которыми на этой улице нашего городка отделялись тротуары от мостовой.	10:13	0:276
раз	NN	example	22	22_раз_188828		На тетю Дорочку раза два взглянул-усмехнулся.	16:20	0:45
раз	NN	example	22	22_раз_207277		Частые переходы вброд через притоки Бяула и два раза через самый Бяул в верхнем его течении.	48:52	0:92
раз	NN	example	22	22_раз_224490		В 1923-- 1925 годах мне было душно не раз-- именно с теми из антропософов, с которыми у меня--«средние» отношения; да и кроме того: иные из«средних» друзей оказывают мне странное, порой тяготящее меня внимание, рассматривая«Бориса Николаевича» как аппарат, выкидывающий слова, книги, лекции, курсы... в пустоту молчания, между тем как«Борис Николаевич», идя к людям, ищет не аудитории, а сердечной, конкретной, социальной связи и, не видя в ответ на биение своего сердца никакого биения, уже механически начинает сотрясением воздуха(прямо скажу,-- из«отчаяния») наполнять вокруг него растущую пустоту с этим его постоянно удручающим«ни да, ни нет»-- на мысли, чувства, волнения.	38:41	0:678
раз	NN	example	22	22_раз_123435		несколько раз было так, что очень мною любимый аромат, через некоторое время начинал пахнуть совершенно не так как казалось раньше. это зависит от много, от настроение, от погоды и даже от того геля для душа которым вы пользуетесь. ну и естественно наша женская психология-- кто-то, что-то сказал по поводу аромата(не очень лестное)мы тут же начинаем внушать себе, ой и правда, что-то в этом есть.  советую не слушать никого, и тем более что Аромат. ru не является таким уж экспертом в области парфюмерии, хотя и достаточно не плохой сайт.	10:13	0:539
раз	NN	example	22	22_раз_206633		Когда я был в Барцелоне, то раз, лежа в постели, я отчетливо увидал один дом из части города, называемой Барцелонепой, дом, на который в действительности я очень мало обратил внимания»(Мори).	28:31	0:191
раз	NN	example	22	22_раз_97413		И один из них, самый небольшой по объему финансирования, в разы(!) меньше остальных--«Предпроектные работы по созданию универсальной системы контроля доступа».	59:63	0:159
раз	NN	example	22	22_раз_133547		За время развития гусеницы линяют четыре раза и проходят пять возрастов(Хомякова, 1966; Монастырский, Горбатовский, 1991).	41:45	0:122
